{
  "version": 1,
  "document_digest": "blake3:3b963643ca135586b2060986cffd981f9994735d5ef8e92397dd757b7ad40679",
  "mappings": [
    {
      "document": {
        "start": 0,
        "end": 17
      },
      "source": {
        "source_id": "document",
        "selectors": [
          {
            "type": "interval",
            "unit": "page",
            "start": 0,
            "end": 1
          }
        ]
      }
    },
    {
      "document": {
        "start": 19,
        "end": 41
      },
      "source": {
        "source_id": "document",
        "selectors": [
          {
            "type": "interval",
            "unit": "page",
            "start": 1,
            "end": 2
          }
        ]
      }
    },
    {
      "document": {
        "start": 43,
        "end": 89
      },
      "source": {
        "source_id": "document",
        "selectors": [
          {
            "type": "interval",
            "unit": "page",
            "start": 2,
            "end": 3
          }
        ]
      }
    }
  ],
  "references": [],
  "page_labels": {
    "document": [
      {
        "start": 0,
        "style": "none",
        "prefix": "Cover"
      },
      {
        "start": 1,
        "style": "roman-lower"
      },
      {
        "start": 2,
        "style": "decimal"
      }
    ]
  }
}
